{
  "schemaVersion": 1,
  "environmentId": "local-dsh",
  "ownership": "managed",
  "state": "healthy",
  "generation": 4,
  "instanceId": "managed-4-1787792400000",
  "processOwnership": "owned",
  "lifecycleMutation": "allowed",
  "readiness": "verified",
  "endpoint": {
    "scheme": "http",
    "host": "127.0.0.1",
    "port": 4317,
    "source": "managed_process_output",
    "verification": "owned_generation_output_and_tcp"
  },
  "stopDisposition": "not_requested",
  "observedAtUnixMs": 1787792400100,
  "recovery": {
    "crashCount": 1,
    "windowStartUnixMs": 1787792340000,
    "budget": 3,
    "safeStop": false,
    "lastCrashAtUnixMs": 1787792380000
  },
  "evidence": [
    {
      "code": "MANAGED_ENDPOINT_VERIFIED",
      "severity": "warning",
      "message": "The owned generation emitted an exact loopback endpoint after a bounded auto-restart recovered a new generation."
    }
  ]
}
